{
  "$schema": "https://json-schema.org/draft/2020-12/schema",
  "$id": "https://zurvival.example/schemas/node.schema.json",
  "title": "Node",
  "description": "A single location within a region \u2014 the unit of the fog-of-war node graph (FR-MAP-01). Static definition only: live per-node memory (searchPct, damage, corpses, noise, fog-of-war discovery, ...) lives in GameState.nodes, seeded from this definition at run start. Routes are the undirected edges of the graph; the engine's map integrity check requires them to be symmetric and the whole region to be connected from its single start node.",
  "type": "object",
  "required": [
    "id",
    "regionId",
    "name",
    "description",
    "adjacent"
  ],
  "additionalProperties": false,
  "properties": {
    "$schema": {
      "type": "string",
      "description": "Optional editor hint pointing at this schema."
    },
    "id": {
      "type": "string",
      "pattern": "^node(?:\\.[a-z0-9]+(?:[-_][a-z0-9]+)*){2}$",
      "description": "Stable content id of the form node.<region-slug>.<node-slug>, e.g. \"node.rivermouth.transit-plaza\". Referenced by id from GameState (never embedded)."
    },
    "regionId": {
      "type": "string",
      "pattern": "^region\\.[a-z0-9]+(?:[-_][a-z0-9]+)*$",
      "description": "Id of the region this node belongs to (FR-MAP-01 \u2014 locations grouped into regions)."
    },
    "name": {
      "type": "string",
      "minLength": 1,
      "description": "Player-facing display name (ICU MessageFormat string, LOCALIZATION \u00a713)."
    },
    "description": {
      "type": "string",
      "minLength": 1,
      "description": "Short flavor description shown when the node is scouted or entered (ICU MessageFormat string)."
    },
    "adjacent": {
      "type": "array",
      "description": "Node ids directly reachable by one travel step (the graph's edges). Must be symmetric (if A lists B, B lists A) \u2014 enforced by the engine's map integrity check, not the schema.",
      "items": {
        "type": "string",
        "pattern": "^node(?:\\.[a-z0-9]+(?:[-_][a-z0-9]+)*){2}$"
      },
      "uniqueItems": true
    },
    "start": {
      "type": "boolean",
      "description": "True on exactly one node per shipped region set \u2014 where a new run begins. The engine rejects a set with zero or many start nodes."
    },
    "claimable": {
      "type": "boolean",
      "description": "True if this node can be claimed as a safehouse (FR-MAP-06). A claimed node can later be lost; claim state itself lives in GameState, not here."
    },
    "notes": {
      "type": "string",
      "description": "Author commentary. JSON has no comments (ADR-0002); use this field."
    },
    "walkers": {
      "type": "integer",
      "minimum": 0,
      "description": "Bodies loitering here at run start \u2014 seeds an avoidable encounter at this node (FR-CBT-01, T15). Live count lives in GameState.nodes; omit for a quiet node (defaults to 0). Since T75 each entry of zombieTypes takes one of these bodies and the rest are plain walkers, so a node with two bodies and two listed types seeds one of each (not two of the most dangerous). If zombieTypes is LONGER than this count, every listed type still gets a body and the seeded total exceeds it \u2014 an authored type is never dropped."
    },
    "kind": {
      "type": "string",
      "enum": [
        "generic",
        "store",
        "medical",
        "police",
        "residential",
        "industrial"
      ],
      "description": "Location kind \u2014 selects the loot plausibility table for searches here (FR-ECO-02, T17). Defaults to generic when absent."
    },
    "richness": {
      "type": "integer",
      "minimum": 0,
      "maximum": 250,
      "description": "How deep this particular building's stock is, as a PERCENTAGE of the ordinary yield for its region (FR-ECO-02, T84). 100 is an ordinary place of its kind and is the default when omitted; below it a place already stripped or never worth much; above it the pharmacy at the end of the block nobody got to. This is the node's only contribution to its own loot beyond the live searchPct \u2014 without it the yield cap has exactly one value per region and two nodes of the same kind in the same district are arithmetically identical. It scales the region's term only, never the picked-over penalty, and is clamped by what the region actually has left, so it redistributes a district's finite stock rather than adding to it. The multiply is gated on SOME node in the set authoring it, so a set that omits it everywhere computes the pre-T84 cap exactly."
    },
    "zombieTypes": {
      "type": "array",
      "description": "Distinct zombie type ids present at this node (FR-CBT-07, T25). Since T75 each seeds one BODY in the node's roster (see walkers); NodeState.zombieTypes is then derived from that roster, so a type clears from the node when its last body is put down.",
      "items": {
        "type": "string",
        "pattern": "^zombie\\.[a-z0-9]+(?:[-_][a-z0-9]+)*$"
      },
      "uniqueItems": true
    }
  }
}
