{
  "$schema": "../schemas/node.schema.json",
  "id": "node.rivermouth.clinic",
  "regionId": "region.rivermouth",
  "name": "Shuttered Clinic",
  "description": "A neighborhood clinic, doors chained from the inside. Medical supplies if you can get in — and the reason the doors were chained, if you can't leave.",
  "kind": "medical",
  "richness": 130,
  "walkers": 2,
  "adjacent": [
    "node.rivermouth.corner-store",
    "node.rivermouth.police-post"
  ],
  "zombieTypes": [
    "zombie.screamer"
  ],
  "notes": "Medical loot vs. danger; the risk/reward node of the ring."
}
