{
  "$schema": "../schemas/node.schema.json",
  "id": "node.ironworks.rail-depot",
  "regionId": "region.ironworks",
  "name": "Rail Depot",
  "description": "A marshalling yard of dead locomotives and stacked containers. The line runs down to the harbor one way and up toward the hills the other.",
  "kind": "industrial",
  "richness": 110,
  "adjacent": [
    "node.ironworks.foundry",
    "node.rivermouth.rail-yard"
  ],
  "walkers": 2,
  "zombieTypes": [
    "zombie.crawler"
  ],
  "notes": "Gateway to Rivermouth (the harbor rail yard); the industrial spine."
}
