{
  "$schema": "../schemas/node.schema.json",
  "id": "node.mercy-hospital.evac-checkpoint",
  "regionId": "region.mercy-hospital",
  "name": "Evac Checkpoint",
  "description": "The Guard's last stand: sandbag walls, a drift of spent brass, a message board thick with photos and names. The evacuation left from here, and then it didn't.",
  "kind": "police",
  "richness": 95,
  "adjacent": [
    "node.mercy-hospital.ambulance-bay",
    "node.mercy-hospital.parking-deck",
    "node.the-terraces.fire-station"
  ],
  "walkers": 3,
  "zombieTypes": [
    "zombie.riot"
  ],
  "notes": "The fallen evacuation point (GDD VII story hook); ammo + story; gateway to the Terraces."
}
