{
  "$schema": "../schemas/node.schema.json",
  "id": "node.rivermouth.transit-plaza",
  "regionId": "region.rivermouth",
  "name": "Transit Plaza",
  "description": "A cracked bus concourse open to the sky. Dead departure boards, a jackknifed coach, and two streets leading off into the haze.",
  "kind": "generic",
  "richness": 50,
  "start": true,
  "adjacent": [
    "node.rivermouth.corner-store",
    "node.rivermouth.overpass"
  ],
  "notes": "Run start. Open, low-cover, deliberately central so the first choice is which way to scout."
}
