{
  "$schema": "../schemas/node.schema.json",
  "id": "node.hillcrest.waterworks",
  "regionId": "region.hillcrest",
  "name": "Waterworks",
  "description": "The treatment plant below the dam — pumps, chlorine drums, the clean pipes the whole city drank from. Restart it and taps run again; the walkers came for the same water.",
  "kind": "industrial",
  "richness": 120,
  "adjacent": [
    "node.hillcrest.reservoir",
    "node.hillcrest.university-quad",
    "node.ironworks.loading-canal"
  ],
  "walkers": 2,
  "zombieTypes": [
    "zombie.bloated"
  ],
  "notes": "Gateway to the Ironworks (the canal); water infrastructure (economy)."
}
