{
  "$schema": "../schemas/node.schema.json",
  "id": "node.rivermouth.overpass",
  "regionId": "region.rivermouth",
  "name": "Collapsed Overpass",
  "description": "A section of raised highway sheared onto the street below. You can pick a path over the rubble, slowly, in the open — or turn back.",
  "kind": "generic",
  "richness": 25,
  "adjacent": [
    "node.downtown.gridlock-bridge",
    "node.rivermouth.marina",
    "node.rivermouth.rail-yard",
    "node.rivermouth.transit-plaza"
  ],
  "notes": "Traversal choke to the marina; the quiet-but-costly route. M4: the ramp up onto the gridlock bridge into Downtown."
}
